{
  "type": "FeatureCollection",
  "coordRefSys": "http://www.opengis.net/def/crs/EPSG/0/27700",
  "featureType": "Airport",
  "geometryDimension": 0,
  "features": [
    {
      "type": "Feature",
      "id": 1,
      "geometry": { "type": "Point", "coordinates": [-1.6930015, 60.3216821] },
      "properties": {"name": "Papa Stour Airstrip"},
      "place": { "type": "Point", "coordinates": [417057.93, 1159772.2] },
      "time": null
    },
    {
      "type": "Feature",
      "id": 2,
      "geometry": { "type": "Point", "coordinates": [-1.2922268, 59.8782666] },
      "properties": {"name": "Sumburgh Airport"},
      "place": { "type": "Point", "coordinates": [439723.69, 1110559.95] },
      "time": null
    },
    {
      "type": "Feature",
      "id": 46,
      "geometry": { "type": "Point", "coordinates": [0.9384272, 50.9556174] },
      "properties": {"name": "Lydd Airport"},
      "place": { "type": "Point", "coordinates": [606468.75, 121465.11] },
      "time": null
    }
  ],
  "links": [
    {
      "href": "https://demo.ldproxy.net/zoomstack/collections/airports/items?crs=http%3A%2F%2Fwww.opengis.net%2Fdef%2Fcrs%2FEPSG%2F0%2F27700&limit=50&f=jsonfg",
      "rel": "self",
      "type": "application/vnd.ogc.fg+json",
      "title": "Dieses Dokument"
    },
    {
      "href": "https://demo.ldproxy.net/zoomstack/collections/airports/items?crs=http%3A%2F%2Fwww.opengis.net%2Fdef%2Fcrs%2FEPSG%2F0%2F27700&limit=50&f=json",
      "rel": "alternate",
      "type": "application/geo+json",
      "title": "Dieses Dokument als GeoJSON"
    },
    {
      "href": "https://demo.ldproxy.net/zoomstack/collections/airports/items?crs=http%3A%2F%2Fwww.opengis.net%2Fdef%2Fcrs%2FEPSG%2F0%2F27700&limit=50&f=html",
      "rel": "alternate",
      "type": "text/html",
      "title": "Dieses Dokument als HTML"
    },
    {
      "href": "https://demo.ldproxy.net/zoomstack/collections/airports/schemas/collection",
      "rel": "describedby",
      "type": "application/schema+json",
      "title": "Schema of feature collections in 'Airports'"
    },
    {
      "href": "https://geojson.org/schema/FeatureCollection.json",
      "rel": "describedby",
      "type": "application/schema+json",
      "title": "This document is a GeoJSON FeatureCollection"
    }
  ]
}